做主,be the master, make one's own decisions
伤脑筋,to be a real headache, to find sth a real headache, to beat one's brains
枯燥,dry and dull, uninteresting, dry-as-dust
擅长,to be good at, to be expert in
成本,(manufacturing, production etc) costs
急躁,irritable, irascible, impetuous
顾虑,misgivings, apprehensions
过度,excessive, over-, excess, going too far, extravagant, intemperate, overdue
致使,to cause, to result in
终身,lifelong, all one's life, marriage
悔恨,remorse, repentance
类似,similar, analogous
并非,really isn't
精确,accurate, precise
天生,nature, disposition, innate, natural
挫折,setback, reverse, check, defeat, frustration, disappointment, to frustrate, to discourage, to set sb back, to blunt, to subdue
意志,will, willpower, determination
敏锐,keen, sharp, acute
畏惧,to fear, to dread, foreboding
勇于,to dare to, to be brave enough to
伴随,to accompany, to follow, to occur together with, concomitant
日益,day by day, more and more, increasingly, more and more with each passing day
昔日,formerly, in olden days
风光,scene, view, sight, landscape, to be well-regarded, to be well-off, grand (dialect), impressive (dialect)
亏损,deficit, (financial) loss
倒闭,to go bankrupt, to close down
金融,banking, finance, financial
危机,crisis
盈利,profit, gain
运行,to be in motion, to move, (of a computer) to run
裁员,to cut staff, to lay off employees
意味着,to signify, to mean, to imply
英明,wise, brilliant
称心如意,after one's heart (idiom); gratifying and satisfactory, everything one could wish
除,to get rid of, to remove, to exclude, to eliminate, to wipe out, to divide, except, not including
争先恐后,striving to be first and fearing to be last (idiom); outdoing one another
热门,popular, hot, in vogue
以致,to such an extent as to, down to, up to
饱和,saturation
就业,looking for employment, getting a job, to start a career
及早,at the earliest possible time, as soon as possible
机遇,opportunity, favorable circumstance, stroke of luck
心灵,bright, smart, quick-witted, heart, thoughts, spirit
免疫,immunity (to disease)
决策,strategic decision, decision-making, policy decision, to determine policy